word,romaji,explanation,properties,examples
ぱらぱら,parapara,"sprinkling (of rain, salt, etc.), pattering; flipping (through a book, etc.), riffling; sparse, scattered, sporadic; crumbly (e.g. tofu, cheese), loose, non-sticky (e.g. rice)",popular; onomatopoeic or mimetic word; adverb; adverb taking the と particle; noun taking the genitive case particle の; adjective (generic); な adjective,上司はパラパラと資料に目を通した。; (雑誌コーナーにて)あみ： VOGUEの新しいの出てるね。ひでみ： あ〜それこの前美容室いった時見た〜あみ： どうだった？ひでみ： パラパラっと見ただけだけど面白かったよ。
ふわふわ,fuwafuwa,"lightly (floating, drifting, etc.), buoyantly; soft, fluffy, spongy; unsteadily, flightily, fickly, frivolously",popular; JLPT N2; onomatopoeic or mimetic word; adverb taking the と particle; adverb; noun taking the genitive case particle の; adjective (generic); な adjective; noun or participle taking the aux. verb する; noun (generic),太郎： そのフワフワした物はな～に？幸子： これは綿菓子っていう甘いお菓子だよ。太郎： うわー、雲みたい！; どこからともなくシャボン玉が飛んできてフワフワとどこかへ行ってしまった。; 天気のいい日に布団をたっぷりと干したのでフワフワした触り心地になった。
ぼやぼや,boyaboya,"to be careless, to be inattentive, to be absentminded, to be slow; long and disheveled (e.g. hair) (dishevelled); flaring up (fire), rising (e.g. steam)",popular; onomatopoeic or mimetic word; noun or participle taking the aux. verb する; verb (generic); noun (generic); adverb; adverb taking the と particle; な adjective; adjective (generic); archaic,
おいおい,oioi,"hey!, wait a minute!, whoa!; boohoo, waaaa",popular; interjection; onomatopoeic or mimetic word; adverb; adverb taking the と particle,
にっこり,nikkori,"sweetly (smiling), broadly (grinning)",popular; JLPT N3; onomatopoeic or mimetic word; adverb; adverb taking the と particle; noun or participle taking the aux. verb する; verb (generic); noun (generic),彼女がにっこり笑うので、彼は恋に落ちた。; 二人はにっこり笑って、家路についた。
にゃー,nya-,"meow, miaow",popular; onomatopoeic or mimetic word; adverb; adverb taking the と particle,
ぐるっと,gurutto,"turning round, going around, turning about, rotating; surrounding, encircling",popular; onomatopoeic or mimetic word; adverb,
ずらり,zurari,"in a row, in a line",popular; JLPT N2; onomatopoeic or mimetic word; adverb taking the と particle; adverb,
せっせと,sesseto,"diligently, assiduously, industriously, beavering away",popular; JLPT N2; onomatopoeic or mimetic word; adverb,
チラリ,chirari,"fleeting (glimpse, glance, etc.)",popular; onomatopoeic or mimetic word; adverb taking the と particle; adverb,
ゆったり,yuttari,"comfortable, easy, calm, relaxed; loose, spacious",popular; onomatopoeic or mimetic word; adverb taking the と particle; adverb; noun or participle taking the aux. verb する; verb (generic); noun (generic),
まったり,mattari,"rich (taste), full-bodied (flavour, flavor), mellow; laid-back (lifestyle), relaxed, comfortable",popular; onomatopoeic or mimetic word; adverb; adverb taking the と particle; noun or participle taking the aux. verb する; verb (generic); noun (generic),
ガシガシ,gashigashi,"boisterously, roughly, briskly",popular; onomatopoeic or mimetic word; adverb; adverb taking the と particle,
ふんわり,funwari,"gently, airily, fluffily",popular; onomatopoeic or mimetic word; adverb taking the と particle; adverb,犬の毛づくろいを久しぶりにしたので毛がふんわりと仕上がった。; お母さん：洗濯機から出てきなさい！息子： 嫌だ！洗濯物がふんわりしててすごく気持ちいいんだもん！
すっぽり,suppori,"entirely, completely; cleanly, snugly",popular; onomatopoeic or mimetic word; adverb; adverb taking the と particle,
グー,gu-,"rock (in rock-paper-scissors), stone, fist; ungh, gulp; rumbling (of an empty stomach), growling, gurgling",popular; noun; noun (generic); onomatopoeic or mimetic word; adverb; interjection; adverb taking the と particle,
グダグダ,gudaguda,"tediously, persistently, repeatedly, at length; lazily, idly, slovenly, sluggishly; (boiling) to a pulp, to a mash, to a mush",popular; onomatopoeic or mimetic word; adverb; adverb taking the と particle; noun or participle taking the aux. verb する; verb (generic); noun (generic); な adjective; adjective (generic),
チェ,che,"tsk, tut, shoot, dang; chirp",popular; onomatopoeic or mimetic word; interjection,
ヌーボー,nu-bo-,"modern, up-to-date; art nouveau; Beaujolais nouveau (wine); vague, fuzzy, elusive, slippery, mysterious",gairaigo; French origin; popular; noun taking the genitive case particle の; adjective (generic); noun; noun (generic); abbreviation; onomatopoeic or mimetic word; たる adjective; adverb taking the と particle,
バタバタ,batabata,"flapping, rattling (sound), noisily, clattering noise; commotion, kerfuffle",popular; onomatopoeic or mimetic word; noun; noun (generic); noun or participle taking the aux. verb する; adverb; adverb taking the と particle,旅行の前はいつもバタバタする。
パサパサ,pasapasa,state of being dried out,popular; onomatopoeic or mimetic word; な adjective; adjective (generic); noun or participle taking the aux. verb する; noun (generic); adverb; noun taking the genitive case particle の,この鶏肉、パサパサとしてておいしくないね。; 俺、もも肉に比べてむね肉ってパサパサしてて好きじゃないな〜
イジイジ,ijiiji,"hesitantly, timidly, diffidently",onomatopoeic or mimetic word; adverb; adverb taking the と particle; noun or participle taking the aux. verb する; verb (generic); noun (generic),流行りのドラマの話についていけずクラスメートから仲間はずれにされてイジイジする。
うじうじ,ujiuji,"indecisively, hesitantly, irresolutely, wishy-washily",onomatopoeic or mimetic word; adverb; adverb taking the と particle; noun or participle taking the aux. verb する; verb (generic); noun (generic),
うじゃうじゃ,ujauja,"in swarms, in clusters; tediously, slowly",onomatopoeic or mimetic word; adverb; adverb taking the と particle; noun or participle taking the aux. verb する; verb (generic); noun (generic),
うぞうぞ,uzouzo,"irrepressibly aroused (esp. sexually), stimulated",onomatopoeic or mimetic word; adverb,
うだうだ,udauda,"going on and on (about inconsequential things), talking nonsense; idling away the time, dawdling",onomatopoeic or mimetic word; adverb; noun or participle taking the aux. verb する; verb (generic); noun (generic),
うねうね,uneune,"winding, meandering, zigzagging, zig-zag, in twists and turns, sinuously, tortuously",onomatopoeic or mimetic word; adverb; adverb taking the と particle; noun or participle taking the aux. verb する; verb (generic); noun (generic),
オタオタ,otaota,"flustered, flurried, (shocked) speechless",onomatopoeic or mimetic word; adverb; adverb taking the と particle; noun or participle taking the aux. verb する; verb (generic); noun (generic),
カチカチ,kachikachi,"ticktock; chinking (e.g. of a hammer against rock), knocking, clicking, clacking, clattering; dry and hard, (frozen) stiff; hidebound, die-hard, stubborn, obstinate, bigoted; scared stiff, tense, nervous, frightened",popular; onomatopoeic or mimetic word; adverb taking the と particle; adverb; noun taking the genitive case particle の; adjective (generic); な adjective,この液体にバナナをつけると一瞬でカチカチに凍ってしまいます。; キャンプ場でライターを忘れたので石をカチカチと打って火を起こした。
カチッと,kachixtsuto,with a click (door sound); with tenseness or firmness,onomatopoeic or mimetic word; adverb; noun or participle taking the aux. verb する; verb (generic); noun (generic),
カチン,kachin,"clink, clack; feeling annoyed, being offended, being hurt",onomatopoeic or mimetic word; adverb taking the と particle; noun; noun (generic),
かっか,kakka,"to burn hotly, to burn redly; to lose one's temper, to get mad, to be upset",onomatopoeic or mimetic word; noun or participle taking the aux. verb する; verb (generic); noun (generic); adverb taking the と particle; adverb,
かっちり,kacchiri,"tightly, exactly, precisely; close-fitting (e.g. suit), firm (body), lean",onomatopoeic or mimetic word; adverb; adverb taking the と particle; noun or participle taking the aux. verb する; verb (generic); noun (generic),
カツカツ,katsukatsu,"barely, just, narrowly, with difficulty",onomatopoeic or mimetic word; adverb; noun taking the genitive case particle の; adjective (generic),
からから,karakara,"parched, dried-up, bone-dry; empty, hollow; rattling, clattering; laughing loudly, roaring with laughter",onomatopoeic or mimetic word; な adjective; adjective (generic); noun taking the genitive case particle の; adverb; adverb taking the と particle,
からっと,karatto,"bright and clear (weather, sky, etc.), perfectly (fine weather); nicely dry (laundry, air, etc.), crisply (fried, cooked, etc.); frankly, open-heartedly",onomatopoeic or mimetic word; adverb; noun or participle taking the aux. verb する; verb (generic); noun (generic),お母さんのから揚げはカラッとジューシーでとても美味しい。
ガーッと,ga-xtsuto,with a grinding noise,onomatopoeic or mimetic word; adverb,
ガクガク,gakugaku,"trembling (with fear, cold, etc.), shaking, chattering (of teeth); coming loose, wobbling",onomatopoeic or mimetic word; adverb; adverb taking the と particle; な adjective; adjective (generic); noun or participle taking the aux. verb する; noun (generic),
ガチガチ,gachigachi,"chattering (teeth); (frozen, worried) stiff; rigid (personality, thinking, etc.), inflexible, overly serious; voracious (e.g. work, study), without slack or pause",onomatopoeic or mimetic word; adverb taking the と particle; な adjective; adjective (generic); noun taking the genitive case particle の; adverb,本番直前で、彼はガチガチに緊張していた。あれでは多分失敗するだろう。; 冷凍庫に入れていたお肉はガチガチに凍っていた。解凍するのにしばらく時間がかかりそうだ。
ガチャガチャ,gachagacha,"clatter, clank, rattling; capsule toy vending machine",onomatopoeic or mimetic word; な adjective; adjective (generic); noun; noun (generic); noun or participle taking the aux. verb する; adverb; adverb taking the と particle,家でくつろいでいたら、玄関から鍵を開ける音がガチャガチャと聞こえてきた。誰か帰ってきたみたいだ。; 下町のあたりは街の雰囲気ががちゃがちゃしている。よく言えば活気があるし、悪く言えば落ち着かない。
がちゃりと,gacharito,with a clank,onomatopoeic or mimetic word; adverb,
ガチャン,gachan,"(with a) slamming noise (door, telephone receiver), (with a) banging noise, (with a) clash (broken dish), (with a) clank, (with a) bang",onomatopoeic or mimetic word; adverb taking the と particle; noun; noun (generic),
がちんがちん,gachingachin,"tick-tock, chipping (sound)",onomatopoeic or mimetic word; noun; noun (generic),
がっぷり,gappuri,"firmly (grasped), latched onto, locked onto",onomatopoeic or mimetic word; adverb; adverb taking the と particle,
ガツガツ,gatsugatsu,"hungrily, voraciously, ravenously; greedily, avariciously, eagerly, ardently",onomatopoeic or mimetic word; adverb; adverb taking the と particle; noun or participle taking the aux. verb する; verb (generic); noun (generic),彼は普段内気な性格だが、女の人のことになると非常にガツガツしている。; お母さん: そんなにガツガツと食べないで。そのお肉は焼けてないわよ。        息子: だって美味しいだもん。とられる前に食べてやる。お母さん: お腹壊しても知らないからね。
ガミガミ,gamigami,"nagging, griping",onomatopoeic or mimetic word; adverb; adverb taking the と particle,
ガラガラ,garagara,"with a clatter, with a rattle; (almost) empty, (mostly) vacant, bare, uninhabited, unoccupied; raspy (voice), gravelly, husky; with a gargle; rough (personality, speech, etc.), unreserved, outspoken, boorish, ill-mannered; rattle (baby's toy); lottery wheel",onomatopoeic or mimetic word; adverb; adverb taking the と particle; noun taking the genitive case particle の; adjective (generic); な adjective; noun or participle taking the aux. verb する; noun (generic); noun,僕の人生設計がガラガラと音を立てて崩れた。; 真菜： 声がガラガラしてるけどどうしたの？秀美： 先週から風邪を引いてのどがつぶれてるんだよ。
キーキー,ki-ki-,"with a (sharp) creak, with a squeak, with a screech",onomatopoeic or mimetic word; adverb; adverb taking the と particle,
きちきち,kichikichi,"jam-packed (physically or of schedule, etc.); grinding noise; precisely, correctly (e.g. when working, etc.); acrida cinerea, oriental longheaded locust",onomatopoeic or mimetic word; な adjective; adjective (generic); adverb taking the と particle; noun; noun (generic),
きっかり,kikkari,"exactly, just, precisely; punctually, exactly on time",JLPT N1; onomatopoeic or mimetic word; adverb,
屹度,kitto,"surely, undoubtedly, almost certainly, most likely (e.g. 90 percent); sternly, severely; having no slack, rigid, stiff, tight; suddenly, abruptly, instantly",popular; ateji; rarely-used kanji form; JLPT N4; usually written using kana alone; onomatopoeic or mimetic word; adverb; archaic,
きびきび,kibikibi,"brisk, lively, energetic",onomatopoeic or mimetic word; adverb; adverb taking the と particle; noun; noun (generic); noun or participle taking the aux. verb する,
きゅうきゅう,kyuukyuu,squeak,onomatopoeic or mimetic word; な adjective; adjective (generic); adverb; noun; noun (generic),
きゅっと,kyutto,"creakingly, squeakingly, squealingly; tightly (squeezing, pressing, etc.); (drinking) all in one sweep",onomatopoeic or mimetic word; adverb,
きんきん,kinkin,"shrill, strident, piercing, tinkling, metallic-sounding; sharp (pain, e.g. headache, earache); ice-cold, very cold",onomatopoeic or mimetic word; adverb; adverb taking the と particle; noun or participle taking the aux. verb する; verb (generic); noun (generic); な adjective; adjective (generic),
ギクシャク,gikushaku,"awkward (movements, speech, etc.), jerky, stiff, stilted; strained (relations), sour",onomatopoeic or mimetic word; adverb; adverb taking the と particle; noun or participle taking the aux. verb する; verb (generic); noun (generic),
刻々,gizagiza,"notches, serration, indentation, jaggies (stair-step artifacts in computer images); notched, serrated, jagged, corrugated, milled",popular; rarely-used kanji form; onomatopoeic or mimetic word; usually written using kana alone; noun; noun (generic); な adjective; adjective (generic); adverb; adverb taking the と particle; noun or participle taking the aux. verb する,
ギスギス,gisugisu,"stiff (atmosphere, manner, etc.), cold, unfriendly, unsociable, edgy; thin and bony, scrawny",onomatopoeic or mimetic word; adverb; adverb taking the と particle; noun or participle taking the aux. verb する; verb (generic); noun (generic),
ぎゅぎゅ,gyugyu,snoringly,onomatopoeic or mimetic word; adverb,
ぎょろぎょろ,gyorogyoro,"goggling, rolling (one's eyes)",onomatopoeic or mimetic word; adverb; adverb taking the と particle; noun or participle taking the aux. verb する; verb (generic); noun (generic),
くさくさ,kusakusa,"feeling depressed, feeling gloomy, feeling downhearted",onomatopoeic or mimetic word; adverb; noun or participle taking the aux. verb する; verb (generic); noun (generic),
くねくね,kunekune,"winding, meandering, wriggling, wiggling, waving, swaying, twisting and turning",onomatopoeic or mimetic word; adverb; adverb taking the と particle; noun or participle taking the aux. verb する; verb (generic); noun (generic),美穂： さっきからくねくねしてどうしたの？飛鳥： トイレに行きたいのを我慢してるんだ！; 観光客： 大学までのいき方を教えてください。警察： そこのくねくねした道を行ったらすぐ着くよ。
クラクラ,kurakura,"dizzy, giddy",onomatopoeic or mimetic word; adverb; adverb taking the と particle; noun or participle taking the aux. verb する; verb (generic); noun (generic),お酒を飲みすぎで寝ても覚めても頭がくらくらする。; 憧れのハリウッド・スターが目の前に現れて頭がくらくらする。
ぐいぐい,guigui,"without hesitation, with great optimism, vigorously, with great vigor, positively; (pushing or pulling) strongly; (drinking) heavily",onomatopoeic or mimetic word; adverb; adverb taking the と particle; noun or participle taking the aux. verb する; verb (generic); noun (generic),
ぐうぐう,guuguu,"fast (asleep), snoring or grumbling sound",onomatopoeic or mimetic word; adverb; adverb taking the と particle,
愚図愚図,guzuguzu,"slowly, tardily, dawdling, lingering, hesitantly; complaining, grumbling; unsettled (e.g. weather); loose, slackened",popular; ateji; rarely-used kanji form; usually written using kana alone; onomatopoeic or mimetic word; adverb; adverb taking the と particle; noun or participle taking the aux. verb する; verb (generic); noun (generic); な adjective; adjective (generic),
ぐちゃぐちゃ,guchagucha,"pulpy, soppy; sloppy, untidy, in a disarray, chaotic",onomatopoeic or mimetic word; adverb; な adjective; adjective (generic); adverb taking the と particle; noun or participle taking the aux. verb する; noun (generic),
ぐっと,gutto,"suddenly, at once, in one go, with a jerk, with a gulp; considerably, very much, a lot; firmly, with an effort, tightly, exerting pressure; completely (e.g. at a loss); deeply (e.g. moved)",JLPT N1; onomatopoeic or mimetic word; adverb,
ぐにゃぐにゃ,gunyagunya,"flabby, limp, soft and pliable",onomatopoeic or mimetic word; な adjective; adjective (generic); noun taking the genitive case particle の; adverb; adverb taking the と particle; noun or participle taking the aux. verb する; noun (generic),
ぐぶぐぶ,gubugubu,"gurgling, sound of rinsing one's mouth",onomatopoeic or mimetic word; adverb; adverb taking the と particle; noun or participle taking the aux. verb する; verb (generic); noun (generic),
ぐんぐん,gungun,"rapidly, vigorously, by leaps and bounds, steadily",onomatopoeic or mimetic word; adverb; adverb taking the と particle,
けばけば,kebakeba,"gaudy, garish, showy",onomatopoeic or mimetic word; adverb; adverb taking the と particle; noun or participle taking the aux. verb する; verb (generic); noun (generic),
げっそり,gessori,"to be disheartened, to be dejected, to be discouraged, to be disappointed; suddenly (losing a lot of weight), looking emaciated, becoming very thin",JLPT N1; onomatopoeic or mimetic word; noun or participle taking the aux. verb する; verb (generic); noun (generic); adverb taking the と particle; adverb,
ゲップ,geppu,"belch, burp, eructation",onomatopoeic or mimetic word; noun; noun (generic),
こせこせ,kosekose,"restlessly, fussily, anxiously, making a fuss over trifles; to be cramped, to be claustrophobic",onomatopoeic or mimetic word; adverb; adverb taking the と particle; noun or participle taking the aux. verb する; verb (generic); noun (generic),
コトコト,kotokoto,"gentle clinking, sound of rapping, sound of rattling, sound of lightly chopping; simmering noise, light bubbling, sound of cooking something on a low flame",onomatopoeic or mimetic word; adverb; adverb taking the と particle,美味しい牛肉が手に入ったのでコトコトとシチューを煮込んでいます。
コロコロ,korokoro,"lightly rolling (of a small and round thing); pleasant, high-pitched sound (e.g. bell, young woman's laughter); changing frequently (e.g. conversation, plans), (occurring) in rapid succession (e.g. sumo wrestlers being defeated), fickly, in a fickle manner; roly-poly; chirp chirp (sound of insects); ribbit ribbit (sound of frogs), croak croak; roller, lint roller, paint roller",popular; onomatopoeic or mimetic word; adverb taking the と particle; adverb; noun or participle taking the aux. verb する; verb (generic); noun (generic); noun,山頂でおにぎりを食べていたら落としてしまってコロコロところがり落ちてしまった。; コロッケを作るには揚げる前にコロコロと手で捏ねないといけません。
ころり,korori,"easily, effortlessly, suddenly, utterly; changing completely; plink (sound of something light falling or rolling)",onomatopoeic or mimetic word; adverb taking the と particle; noun; noun (generic),
コンコン,konkon,"tap-tap, knock-knock, bang-bang; cough-cough; bark (of a fox), yelp, cry; heavily (e.g. of snow falling); fox",onomatopoeic or mimetic word; adverb; adverb taking the と particle; children's language; noun; noun (generic),登山中にこんこんと水が湧き出ている泉があったのでのどを潤した。; お母さん： あそこに狐がいるよ！子供： お母さん、あれは狐じゃないよ。だってコンコンとなかないじゃない。
ごそごそ,gosogoso,"with a rustling sound, (rummaging) around",onomatopoeic or mimetic word; adverb; adverb taking the と particle; noun or participle taking the aux. verb する; verb (generic); noun (generic),正弘： 何か外からゴソゴソ聞こえない？智里： 聞こえる！外に何かいる！絶対にテントから外に出ちゃだめだよ。
ゴタゴタ,gotagota,"trouble, difficulties, dispute, quarrel, discord, dissension; confusion, disorder, mess, muddle",onomatopoeic or mimetic word; noun; noun (generic); noun or participle taking the aux. verb する; intransitive verb; adverb; adverb taking the と particle,
ごちゃごちゃ,gochagocha,"messy, confused, chaotic, disorderly, mixed-up, jumbled up; complaining about various things",onomatopoeic or mimetic word; な adjective; adjective (generic); noun taking the genitive case particle の; adverb; adverb taking the と particle; noun or participle taking the aux. verb する; noun (generic),
ごぼごぼ,gobogobo,"gurgling, burbling, bubbling, sound of water mixing with air (e.g. water welling up, pouring water, drain pipe, gushing forth)",onomatopoeic or mimetic word; adverb taking the と particle,
サクサク,sakusaku,"crisp (not moist or juicy), crunchy, flaky (as in pastry); crunching sound (of walking on snow, frost, sand, etc.); doing skillfully and efficiently, doing quickly, proceeding smoothly; sound of pouring liquid; speaking clearly",onomatopoeic or mimetic word; adverb; adverb taking the と particle; noun or participle taking the aux. verb する; verb (generic); noun (generic); archaic,揚げたての豚カツはサクサクして美味しいな！; 夜、テスト勉強をしていて、あまり集中できなかったので音楽を聴いたら、勉強がサクサク進んだ。
サバサバ,sabasaba,"relieved, refreshed; frank, candid, easy-going, laid-back",onomatopoeic or mimetic word; adverb; adverb taking the と particle; noun or participle taking the aux. verb する; verb (generic); noun (generic),
ザクザク,zakuzaku,"walking on frost, crunching (e.g. on gravel); lots of coins or jewels; cutting into large pieces, loosely weaving; large (pieces, stitches, sand grains, etc.)",onomatopoeic or mimetic word; adverb; adverb taking the と particle; な adjective; adjective (generic),
しっくり,shikkuri,"exactly, nicely, to a tee; to be fitting",onomatopoeic or mimetic word; adverb taking the と particle; noun or participle taking the aux. verb する; verb (generic); noun (generic),
沁み沁み,shimijimi,"keenly, deeply, fully, heartily, seriously, earnestly; calmly, quietly, softly; fixedly (gazing, staring), intently",popular; rarely-used kanji form; JLPT N2; onomatopoeic or mimetic word; usually written using kana alone; adverb; adverb taking the と particle,
しゃきしゃき,shakishaki,"crisp, crunchy, precise, clipped, brisk",onomatopoeic or mimetic word; adverb; adverb taking the と particle; noun or participle taking the aux. verb する; verb (generic); noun (generic),
じくじく,jikujiku,"oozing, damp, sodden",onomatopoeic or mimetic word; adverb; adverb taking the と particle; noun or participle taking the aux. verb する; verb (generic); noun (generic),
じたばた,jitabata,"(kicking and) struggling, wriggling, floundering, flailing; to get into a panic, to make a fuss, to make a scene",onomatopoeic or mimetic word; adverb; adverb taking the と particle; noun or participle taking the aux. verb する; verb (generic); noun (generic),泥棒が警察に捕まってジタバタと抵抗する。; デパートのおもちゃ売り場でおもちゃを買って欲しい子供が床に寝転がってジタバタしている。
凝乎と,jitto,"motionlessly (e.g. stand, wait), (be) still; fixedly (e.g. gaze, stare), intently (e.g. listen, think); patiently (endure), stoically; firmly (e.g. hold), restrained",popular; rarely-used kanji form; JLPT N3; onomatopoeic or mimetic word; usually written using kana alone; adverb; noun or participle taking the aux. verb する; verb (generic); noun (generic),
