word,romaji,explanation,properties,examples
すっすっ,sussuxtsu,"smoothly, frictionlessly, easily",onomatopoeic or mimetic word; adverb taking the と particle; adverb,
そろり,sorori,slowly and quietly; smoothly,onomatopoeic or mimetic word; adverb taking the と particle; adverb,
ちょっきり,chokkiri,"exactly, just; snip",onomatopoeic or mimetic word; adverb; adverb taking the と particle,
つっと,tsutto,"quickly, smoothly",onomatopoeic or mimetic word; adverb,
てらてら,teratera,"gleamingly, shinily",onomatopoeic or mimetic word; adverb; adverb taking the と particle; noun or participle taking the aux. verb する; verb (generic); noun (generic),
のっそり,nossori,"sluggishly, slowly, ploddingly, lumbering; stolidly (standing), impassively",onomatopoeic or mimetic word; adverb; adverb taking the と particle; noun or participle taking the aux. verb する; verb (generic); noun (generic),
のめのめ,nomenome,shamelessly,onomatopoeic or mimetic word; adverb; adverb taking the と particle; noun or participle taking the aux. verb する; verb (generic); noun (generic),
はらり,harari,gently (falling),onomatopoeic or mimetic word; adverb taking the と particle; adverb,
ぴよぴよ,piyopiyo,"cheep cheep, tweet tweet; gently (moving)",onomatopoeic or mimetic word; adverb; adverb taking the と particle,ひよこがピヨピヨないている。; ひよこの鳴き声はピヨピヨ、にわとりの鳴き声はコケコッコー、と表現されます。
びたびた,bitabita,"drenched, soaked; romantically",onomatopoeic or mimetic word; noun taking the genitive case particle の; adjective (generic); な adjective; adverb; noun or participle taking the aux. verb する; noun (generic),
ぴちっと,pichitto,"tightly, snugly",onomatopoeic or mimetic word; adverb; noun or participle taking the aux. verb する; verb (generic); noun (generic),
ぴっちり,picchiri,"tightly, snugly",onomatopoeic or mimetic word; adverb; adverb taking the と particle; noun or participle taking the aux. verb する; verb (generic); noun (generic),
へこへこ,hekoheko,"pliantly, pliably; subserviently, ingratiatingly, servilely",onomatopoeic or mimetic word; adverb; adverb taking the と particle; noun or participle taking the aux. verb する; verb (generic); noun (generic),
ぼそっと,bosotto,"absent-mindedly, vacantly, idly, lazily; in a whisper",onomatopoeic or mimetic word; adverb; noun or participle taking the aux. verb する; verb (generic); noun (generic),
ぽちぽち,pochipochi,"spattering, splotching; step-by-step, little-by-little; soon; dots; ditto mark",onomatopoeic or mimetic word; adverb; adverb taking the と particle; noun; noun (generic),
ぽっちり,pocchiri,"very slightly, a little",onomatopoeic or mimetic word; adverb; adverb taking the と particle,
ムカッと,mukaxtsuto,"feeling sick (suddenly), feeling queasy, feeling nauseated; being angry (suddenly), being offended, being disgusted",onomatopoeic or mimetic word; adverb; noun or participle taking the aux. verb する; verb (generic); noun (generic),
めためた,metameta,beyond repair,onomatopoeic or mimetic word; な adjective; adjective (generic),
もさっと,mosatto,"absentmindedly, vacantly, dully; to be unattractive, to be unsophisticated, to be unrefined, to be uncouth",onomatopoeic or mimetic word; adverb; noun or participle taking the aux. verb する; verb (generic); noun (generic),
もっそり,mossori,slowly; unrefined,onomatopoeic or mimetic word; adverb taking the と particle; adverb; noun or participle taking the aux. verb する; verb (generic); noun (generic),
もっさり,mossari,"slow, sluggish, dim-witted; bushy (hair), thick; unfashionable, lacking style",onomatopoeic or mimetic word; adverb; noun or participle taking the aux. verb する; verb (generic); noun (generic),
ムギュウ,mugyuu,"squeezing, hug, hugging",onomatopoeic or mimetic word; noun; noun (generic),
ブーン,bu-n,"whirr, hum, buzz; whoosh, woosh, whiz",onomatopoeic or mimetic word; adverb taking the と particle; adverb,
ボカッ,bokaxtsu,"bop, pow, bonk, thump",onomatopoeic or mimetic word; adverb; adverb taking the と particle,
グビグビ,gubigubi,in loud gulps (esp. of alcohol),onomatopoeic or mimetic word; adverb; adverb taking the と particle,
カランカラン,karankaran,clank clank,onomatopoeic or mimetic word; adverb taking the と particle,
こん,kon,"with a bump, with a clunk; yelp (e.g. of a fox), bark, howl",onomatopoeic or mimetic word; adverb taking the と particle; adverb,
けたけた,ketaketa,"laughing foolishly, cackling",onomatopoeic or mimetic word; adverb; adverb taking the と particle,
ごんごん,gongon,"bang, clang",onomatopoeic or mimetic word; adverb,
びしり,bishiri,"with a snap, (break) cleanly; (rejecting) sternly, flatly; smartly, (dressing up) well",onomatopoeic or mimetic word; adverb taking the と particle,
にょきにょき,nyokinyoki,"(shooting up) one after another, (sprouting up) all over the place; (growing) rapidly",onomatopoeic or mimetic word; adverb; adverb taking the と particle,この前蒔いた種から新芽がニョキニョキ生えてきた。; たけのこがニョキニョキ生える。
ピクピク,pikupiku,twitching,onomatopoeic or mimetic word; adverb; adverb taking the と particle; noun or participle taking the aux. verb する; verb (generic); noun (generic),
ぴくんぴくん,pikunpikun,"with a twitch, twitchingly",onomatopoeic or mimetic word; adverb; adverb taking the と particle; noun or participle taking the aux. verb する; verb (generic); noun (generic),
どさり,dosari,with a thud,onomatopoeic or mimetic word; adverb taking the と particle,
ぽとり,potori,"with a ""plop"" (of tears, drop of water, etc.)",onomatopoeic or mimetic word; adverb taking the と particle,
ドシンドシン,doshindoshin,"walking (with heavy steps), tramping, lumbering, clumping",onomatopoeic or mimetic word; adverb taking the と particle,わたしの上の階に住んでいる人はよほど体が大きいようで、歩くたびどしんどしんと音が聞こえて来る。夜などは迷惑だ。; 動物園で見た象はとても大きかった。歩くたびどしんどしんと聞こえてきそうだった。
シューシュー,shu-shu-,"hiss, fizz, woosh, swish, whiz",onomatopoeic or mimetic word; adverb taking the と particle,
バンバン,banban,"with a bang bang (e.g. repeated sound of a hammer or gunfire); at a mad pace, with great vigor",onomatopoeic or mimetic word; adverb,
ブスブス,busubusu,"sputtering, smoldering; repeated thrusting into something (sword, needle, etc.), pricking repeatedly; mutterings of discontent, faint sounds of complaint",onomatopoeic or mimetic word; adverb taking the と particle; adverb; noun or participle taking the aux. verb する; verb (generic); noun (generic),
ぐにゃり,gunyari,"flabbily, softly, limply, easily (bend), effortlessly, flexibly, mushily",onomatopoeic or mimetic word; adverb; adverb taking the と particle,
ちょん,chon,"clap (sound of wooden clappers); chop vigorously; slight movement (e.g. poke, small bird alighting); the end, originally end of a play, marked by clap of clappers; dot (esp. typographical)",onomatopoeic or mimetic word; adverb taking the と particle; noun; noun (generic),
ばきっと,bakitto,snapping (e.g. branch),onomatopoeic or mimetic word; adverb,
ねとねと,netoneto,"stickily, gooily, syrupily",onomatopoeic or mimetic word; adverb; noun or participle taking the aux. verb する; verb (generic); noun (generic),
ぴしり,pishiri,"with a click, with a snap",onomatopoeic or mimetic word; adverb taking the と particle,
ぎこぎこ,gikogiko,"squeak squeak, squeaking",onomatopoeic or mimetic word; adverb; adverb taking the と particle,
ガクガクブルブル,gakugakuburuburu,chattering (of teeth) and trembling (with fear),onomatopoeic or mimetic word; adverb taking the と particle; noun or participle taking the aux. verb する; verb (generic); noun (generic),
バキバキ,bakibaki,"with a crack (e.g. branches, knuckles)",onomatopoeic or mimetic word; adverb; adverb taking the と particle,
キャン,kyan,"yelp; sales campaign; kiang (Equus hemionus kiang), kyang",onomatopoeic or mimetic word; adverb taking the と particle; abbreviation; noun; noun (generic),
かしゃかしゃ,kashakasha,"click-clack, clickety-click, clicking sound, clattering sound",onomatopoeic or mimetic word; adverb taking the と particle,
ゲーゲー,ge-ge-,(with a) vomiting sound,onomatopoeic or mimetic word; adverb; adverb taking the と particle,
パチン,pachin,"with a click, with a snap; ornamental clip (hair, obi, etc.)",onomatopoeic or mimetic word; adverb taking the と particle; adverb; abbreviation; noun; noun (generic),マジシャンが指をパチンとならすとハットから鳩が出てきた。; 彼女は彼の頬をぱちんと叩いた。
ゴツンゴツン,gotsungotsun,"thumping, banging",onomatopoeic or mimetic word; adverb; adverb taking the と particle,
ばちん,bachin,"(with a) slap, smack, whack, sound of a sharp blow with something flat; wham, sound of striking with something solid; zap, crack, sound of thunder",onomatopoeic or mimetic word; adverb taking the と particle,
ドスンドスン,dosundosun,"thud thud (esp. footsteps), clump clump",onomatopoeic or mimetic word; adverb,
どすっと,dosutto,"thump, thud, bump, clunk",onomatopoeic or mimetic word; adverb,
ひゅーっ,hyu-xtsu,"(with a) whizzing sound, sound of something whizzing by",onomatopoeic or mimetic word; adverb taking the と particle,
シコシコ,shikoshiko,"chewy, springy, al dente; slowly but steadily; masturbation, fap fap",onomatopoeic or mimetic word; noun; noun (generic); noun or participle taking the aux. verb する,
習習,shuushuu,gentle breeze,onomatopoeic or mimetic word; たる adjective; adjective (generic); adverb taking the と particle,
ぷっつり,puttsuri,"(breaking) with a snap (of a thread, rope, etc.); (stopping) suddenly (of communications, a practice, etc.), abruptly, completely, once and for all",onomatopoeic or mimetic word; adverb; adverb taking the と particle,
ギンギン,gingin,"ecstatic, ecstatically; splitting headache",onomatopoeic or mimetic word; adverb,
トコトコ,tokotoko,"briskly with small steps, trotting",onomatopoeic or mimetic word; adverb; adverb taking the と particle,
ずらずら,zurazura,"in succession, in an endless stream, continuing without pause or interruption",onomatopoeic or mimetic word; adverb taking the と particle,
こっきり,kokkiri,"only, just; with a snap",suffix; onomatopoeic or mimetic word; obsolete term; adverb,
くっくっと,kukkutto,"with a chuckle, with a giggle",onomatopoeic or mimetic word; adverb,
かぴかぴ,kapikapi,"crusty, flaky, dried out",onomatopoeic or mimetic word; colloquial; な adjective; adjective (generic); adverb; noun taking the genitive case particle の,
ダボダボ,dabodabo,"loose (of clothing), loose-fitting; plenty (of pouring a liquid); sloshing about (e.g. of water in one's stomach)",onomatopoeic or mimetic word; noun taking the genitive case particle の; adjective (generic); な adjective; adverb taking the と particle; noun or participle taking the aux. verb する; noun (generic); adverb,
すっぱ,suppa,"cleanly (cutting, snapping off, etc.), in a single blow",onomatopoeic or mimetic word; adverb; adverb taking the と particle,
ふっくり,fukkuri,"fully, luxuriantly, fluffy, plump, soft and full, corpulent",onomatopoeic or mimetic word; adverb taking the と particle,
ちろちろ,chirochiro,"flicker (light), waver; trickle (water); glance at",onomatopoeic or mimetic word; adverb taking the と particle,
トホホ,tohoho,"boo-hoo, boo-hoo-hoo",onomatopoeic or mimetic word; interjection; な adjective; adjective (generic),
ばっさばっさ,bassabassa,"rapidly, flapping wings",onomatopoeic or mimetic word; adverb taking the と particle; adverb,
噁噁,akuaku,"chirp, tweet, caw",onomatopoeic or mimetic word; usually written using kana alone; adverb,
ぺらっと,peratto,"flipping (e.g. a page), peeling off; fluently",onomatopoeic or mimetic word; adverb,
ぷるぷる,purupuru,"trembling, shivering; jiggling, wobbling, bouncing",onomatopoeic or mimetic word; adverb; adverb taking the と particle; noun or participle taking the aux. verb する; verb (generic); noun (generic),
のしのし,noshinoshi,"walking heavily, lumbering",onomatopoeic or mimetic word; adverb; adverb taking the と particle,
ざぶりざぶり,zaburizaburi,"sound of living, moving water",onomatopoeic or mimetic word; adverb taking the と particle,
じとじと,jitojito,"damp, wet, soaked, humid, clammy",onomatopoeic or mimetic word; な adjective; adjective (generic); adverb; adverb taking the と particle; noun or participle taking the aux. verb する; noun (generic),
ぺたり,petari,"slapping on (stamp, sticker); flopping down",onomatopoeic or mimetic word; adverb taking the と particle,
つるり,tsururi,"smoothly, with a slipping or sliding motion",onomatopoeic or mimetic word; adverb taking the と particle,
メリメリ,merimeri,"cracking, splitting, ripping, crashing, creaking, groaning",onomatopoeic or mimetic word; adverb taking the と particle,
タプタプ,taputapu,flabby,onomatopoeic or mimetic word; noun taking the genitive case particle の; adjective (generic); adverb; adverb taking the と particle; noun or participle taking the aux. verb する; noun (generic),
たぶたぶ,tabutabu,"brimming, full to the point of overflowing; loose, baggy",onomatopoeic or mimetic word; adverb taking the と particle,
フッ,fuxtsu,"hah (derisively), pooh; pfft (of something disappearing), poof; huff, puff",interjection; onomatopoeic or mimetic word; adverb taking the と particle,
ばちゃん,bachan,with a splash,onomatopoeic or mimetic word; adverb; adverb taking the と particle,
ぴょこぴょこ,pyokopyoko,"up and down, lightly, nimbly, moving in small leaps as a frog or rabbit; casually, (strolling about) without a care",onomatopoeic or mimetic word; adverb taking the と particle,
どっぴゅ,doppyu,sound of something being powerfully ejected,onomatopoeic or mimetic word; adverb; adverb taking the と particle,
ことん,koton,"clunk, thump",onomatopoeic or mimetic word; adverb taking the と particle,
ぴゅう,pyuu,"whiz (e.g. projectile through air), swoosh, whoosh, whistling sound",onomatopoeic or mimetic word; adverb taking the と particle,
くるっと,kurutto,"turning around, spinning around, curling up; round and charming (e.g. eyes)",onomatopoeic or mimetic word; adverb; noun or participle taking the aux. verb する; verb (generic); noun (generic),道を間違えたので車をくるっとＵターンさせた。
ぱらり,parari,"sprinkling, dropping in small light bits",onomatopoeic or mimetic word; adverb taking the と particle; adverb,
どうと,douto,"crash, smash, bang, sound of a large, heavy object falling",obsolete reading; onomatopoeic or mimetic word; adverb,
ピチャリ,pichari,"sound of a small wave hitting the shore, sound of a whip, sound of a slap",onomatopoeic or mimetic word; adverb,
ぴちゃん,pichan,"splash; slam, slap",onomatopoeic or mimetic word; adverb taking the と particle; adverb,
とろり,torori,"thickly, viscously, stickily, creamily, (melting and) becoming soft; sleepily, drowsily, dozing off",onomatopoeic or mimetic word; adverb taking the と particle; adverb,
ごとり,gotori,"with a thump, with a clang, with a clank",onomatopoeic or mimetic word; adverb taking the と particle,
そぼそぼ,sobosobo,drizzling (rain),onomatopoeic or mimetic word; adverb; adverb taking the と particle,
デクデク,dekudeku,"plump, fat",onomatopoeic or mimetic word; adverb,
シュッシュッ,shusshuxtsu,"choo-choo, chug-chug, chuff-chuff, hiss-hiss; brush-brush, scrub-scrub",onomatopoeic or mimetic word; adverb taking the と particle; adverb,
どしり,doshiri,sound of a heavy object falling,onomatopoeic or mimetic word; adverb taking the と particle; adverb,
どかり,dokari,falling heavily,onomatopoeic or mimetic word; adverb taking the と particle; adverb,
ボーボー,bo-bo-,"vigorously (burning), furiously, fiercely",onomatopoeic or mimetic word; adverb taking the と particle; adverb,
ジンジン,jinjin,"(painful) tingling, throbbing (with pain), stinging, feeling numb; noisily (ringing)",onomatopoeic or mimetic word; adverb; adverb taking the と particle,昨日こけたところがまだまだジンジンと痛む。; 虫歯がひどくなってジンジンと痛み出してきた。
バリッと,barixtsuto,"with a crack, with a tearing sound, with a ripping sound; stylish, smart, dapper, dashing, spruce",onomatopoeic or mimetic word; adverb; noun or participle taking the aux. verb する; verb (generic); noun (generic),激しいダンスを踊ったせいでズボンがバリッと破れてしまった。; (板チョコやおせんべいなどを)クリス： これどうやって分けよう？ジャスティン： バリッと割っちゃえば？
ぽちゃり,pochari,"splash, splosh",onomatopoeic or mimetic word; adverb taking the と particle; adverb,
ぐらり,gurari,shaking violently,onomatopoeic or mimetic word; adverb taking the と particle; adverb,
ポッと,poxtsuto,"slightly (blushing); suddenly (getting bright, flaring up, flashing on, etc.); distractedly",onomatopoeic or mimetic word; adverb; noun or participle taking the aux. verb する; verb (generic); noun (generic),
ぶるん,burun,"with a vroom, with a sudden shaking",onomatopoeic or mimetic word; adverb taking the と particle; adverb,
どんぶりこ,donburiko,"plop, splash; tumbling",onomatopoeic or mimetic word; adverb; adverb taking the と particle,
チュンチュン,chunchun,"chirp, cheep",onomatopoeic or mimetic word; adverb; adverb taking the と particle,朝はスズメのチュンチュンと鳴く声で目が覚める。
ぎいとん,giiton,squeaking or creaking (followed by a thump),onomatopoeic or mimetic word; adverb; adverb taking the と particle,
むくむく,mukumuku,"rising up (of smoke, clouds, etc.), towering, billowing; plump, chubby; welling up (of an emotion), boiling up; getting up, stirring, moving about; shaggy, hairy",onomatopoeic or mimetic word; adverb; adverb taking the と particle; noun or participle taking the aux. verb する; verb (generic); noun (generic),
ほんわか,honwaka,"warm, snug, cozy, cosy, comfortable, pleasant, soft, fluffy, gentle",onomatopoeic or mimetic word; adverb; adverb taking the と particle,
ぱったり,pattari,"unexpectedly, suddenly, abruptly",onomatopoeic or mimetic word; adverb; adverb taking the と particle,
ぶらりぶらり,burariburari,"dangling, swaying, swinging; (walking) leisurely, aimlessly, strolling, wandering, rambling; idly, lazily, leisurely, aimlessly",onomatopoeic or mimetic word; adverb; adverb taking the と particle,
パカパカ,pakapaka,"clip-clop, clippety-clop; clamshell cellphone, flip cellphone",onomatopoeic or mimetic word; adverb taking the と particle; adverb; noun; noun (generic),
とくとく,tokutoku,glug-glug,onomatopoeic or mimetic word; adverb taking the と particle; adverb,
とん,ton,"tap, knock, bonk",onomatopoeic or mimetic word; adverb taking the と particle; adverb,
ザブン,zabun,"splash, plop",onomatopoeic or mimetic word; adverb taking the と particle; adverb,
パシャッと,pashaxtsuto,"with a splash, with a splosh; with a click (of a camera shutter), with a snap",onomatopoeic or mimetic word; adverb,
じわっと,jiwatto,slowly but steadily,onomatopoeic or mimetic word; adverb,
ペロリ,perori,"(eating up) quickly, in no time, gobbling up; quickly (sticking out one's tongue); licking, licking up; (peeling off) in one go, completely",onomatopoeic or mimetic word; adverb taking the と particle; adverb,まゆ： 甘いものに目がないんだ〜、いくらでも食べてしまう。ゆき： そうなんだ、じゃあホールのケーキ一人で食べれる？まゆ： そんなのペロリだね。
ぴりり,piriri,"tingling, stinging, pungently",onomatopoeic or mimetic word; adverb; adverb taking the と particle; noun or participle taking the aux. verb する; verb (generic); noun (generic),
ぷるんぷるん,purunpurun,"shaking like a jelly, jellylike",onomatopoeic or mimetic word; noun; noun (generic); noun or verb acting prenominally; adjective (generic); noun or participle taking the aux. verb する,
ばしっと,bashitto,"whack, smack",onomatopoeic or mimetic word; adverb,
しねしね,shineshine,"soft and elastic, flexible, pliant",onomatopoeic or mimetic word; adverb; adverb taking the と particle; noun or participle taking the aux. verb する; verb (generic); noun (generic),
のそりのそり,nosorinosori,"slowly, stolidly, heavily, lumpingly",onomatopoeic or mimetic word; adverb; adverb taking the と particle,
ぷるん,purun,"shaking like a jelly, jellylike",onomatopoeic or mimetic word; noun; noun (generic); noun or verb acting prenominally; adjective (generic); noun or participle taking the aux. verb する,
こちょこちょ,kochokocho,"coochy-coo, hitchy-koo, kitchy-koo (tickling sound)",onomatopoeic or mimetic word; adverb; adverb taking the と particle; noun or participle taking the aux. verb する; verb (generic); noun (generic),
ごそり,gosori,"rustling sound, rummaging sound",onomatopoeic or mimetic word; adverb; adverb taking the と particle,
がさり,gasari,rustling sound; search (esp. a home search by the police),onomatopoeic or mimetic word; adverb taking the と particle; adverb; rare term; slang; noun; noun (generic),
すぽっと,supotto,"snugly (into hole, container, etc.), tightly (fitting, covering), firmly; (with a) pop (i.e. sound of a cork, etc. being pulled out of a hole in one movement), with a plop, (fall) straight",onomatopoeic or mimetic word; adverb,
ぷつぷつ,putsuputsu,"bumpy (e.g. of a rash), knobbly, pimply; easily cut",onomatopoeic or mimetic word; adverb; adverb taking the と particle; noun or participle taking the aux. verb する; verb (generic); noun (generic),
ゆくと,yukuto,"slowly, unhurriedly, without haste, leisurely, at one's leisure",onomatopoeic or mimetic word; archaic; adverb,
ぽつねんと,potsunento,"solitarily, in a lonely fashion, all alone, by oneself",onomatopoeic or mimetic word; adverb; noun or participle taking the aux. verb する; verb (generic); noun (generic),
パチ,pachi,"snapping (e.g. book shut), clapping, crackling, sputtering; pachinko",onomatopoeic or mimetic word; noun; noun (generic); adverb taking the と particle; abbreviation; slang,
ボキボキ,bokiboki,"cracking sound (e.g. cracking one's knuckles), crunching sound",onomatopoeic or mimetic word; adverb; adverb taking the と particle,
すってんころり,suttenkorori,"falling plump, falling down flat",onomatopoeic or mimetic word; adverb; adverb taking the と particle,
ポロン,poron,"strumming, thrumming, plunking, plonking",onomatopoeic or mimetic word; noun; noun (generic); adverb taking the と particle,
しっちゃかめっちゃか,shicchakamecchaka,"in a terrible mess, in complete disorder, chaotic",onomatopoeic or mimetic word; な adjective; adjective (generic),
かたこと,katakoto,"click-clack, clip-clop, clatter",onomatopoeic or mimetic word; adverb; adverb taking the と particle,
ぺっと,petto,"ptoo (i.e. spitting sound), ptew, ptooey",onomatopoeic or mimetic word; adverb,
ばしばし,bashibashi,"violently, without holding anything back; firmly, resolutely",onomatopoeic or mimetic word; adverb; adverb taking the と particle,
ちくりちくり,chikurichikuri,"prickling, stinging, biting",onomatopoeic or mimetic word; adverb; adverb taking the と particle,
ちくっと,chikutto,"pricking, stinging, tingling",onomatopoeic or mimetic word; adverb,
ピンと,pinto,"tightly, tautly, tensely; (springing, straightening) up, suddenly, with a jerk; intuitively, instinctively, immediately; with a burst, with a crack, with a snap, with a twang",onomatopoeic or mimetic word; adverb; noun or participle taking the aux. verb する; verb (generic); noun (generic),寒い冬の朝は自然と背筋がピンと伸びる。; そのヒントを聞いて、彼はピンと来た。
パシャリ,pashari,sound of a camera shutter; sound of water splashing,onomatopoeic or mimetic word; adverb; adverb taking the と particle,
ビシバシ,bishibashi,"without holding anything back, mercilessly, relentlessly, energetically, vigorously",onomatopoeic or mimetic word; adverb; adverb taking the と particle,
どたんばたん,dotanbatan,banging around (e.g. in a fight),onomatopoeic or mimetic word; adverb taking the と particle; adverb,
けちょんけちょん,kechonkechon,"thorough (criticism, defeat, etc.), utter, serious",colloquial; onomatopoeic or mimetic word; な adjective; adjective (generic),
がじがじ,gajigaji,"biting, gnawing; in constant pain, irritated",onomatopoeic or mimetic word; adverb; adverb taking the と particle,
どばどば,dobadoba,"pouring out in large amounts, flowing out gushingly",onomatopoeic or mimetic word; adverb; adverb taking the と particle,
ぶるっと,burutto,shiveringly,onomatopoeic or mimetic word; adverb,
ポトン,poton,"plop, plonk, plunk, flop",onomatopoeic or mimetic word; adverb taking the と particle; noun; noun (generic),
ブルルン,bururun,"va-va-vroom (esp. fast cars or bikes, sexy women or men), va-voom, vrrrm; sound of animal shaking its fur to dry off after getting wet (esp. dogs)",onomatopoeic or mimetic word; interjection,
ぐしぐし,gushigushi,"grumbling, complaining, muttering; crumpling (e.g. paper)",onomatopoeic or mimetic word; adverb; adverb taking the と particle,
こそっと,kosotto,"stealthily, secretly",onomatopoeic or mimetic word; adverb,
