index,word,romaji,explanation,properties,examples
770,バリン,barin,"valine; (with a) whoomp, smash, crunch",noun; noun (generic); onomatopoeic or mimetic word; adverb,
771,ゲソゲソ,gesogeso,looking very thin,onomatopoeic or mimetic word; rare term; adverb,
772,すかり,sukari,net for caught fish; net-like tassel of Buddhist prayer beads; Vespula flaviceps (species of yellowjacket); ant; easily,noun; noun (generic); Touhoku-ben; Kyuushuu-ben; onomatopoeic or mimetic word; adverb; adverb taking the と particle,
773,きしり,kishiri,"creak, squeak",onomatopoeic or mimetic word; adverb taking the と particle; adverb,
774,きちんきちん,kichinkichin,"correctly, properly, accurately",onomatopoeic or mimetic word; adverb taking the と particle; adverb,
775,ぎくぎく,gikugiku,jerkily,onomatopoeic or mimetic word; adverb; adverb taking the と particle; noun or participle taking the aux. verb する; verb (generic); noun (generic),
776,ギチギチ,gichigichi,creakily; close (i.e. with no room to spare),onomatopoeic or mimetic word; adverb; adverb taking the と particle; noun or participle taking the aux. verb する; verb (generic); noun (generic); な adjective; adjective (generic),
777,ぎろぎろ,girogiro,glaringly (staring),onomatopoeic or mimetic word; adverb; adverb taking the と particle; noun or participle taking the aux. verb する; verb (generic); noun (generic),
778,ぐじゃぐじゃ,gujaguja,"soggy, soaking, drenched; incessantly (complaining)",onomatopoeic or mimetic word; noun taking the genitive case particle の; adjective (generic); な adjective; adverb; adverb taking the と particle,
779,ごしゃごしゃ,goshagosha,"jumbled, disarrayed, messy",onomatopoeic or mimetic word; noun taking the genitive case particle の; adjective (generic); な adjective; adverb; adverb taking the と particle; noun or participle taking the aux. verb する; noun (generic),
780,ゴリゴリ,gorigori,"with a scraping sound, with a grating sound, with a scratching sound; with force, hard, vigorously; forcibly (carry out), forcefully, in a pushy manner; hard (e.g. food), stiff (e.g. clothing); inflexible, uncompromising, dyed-in-the-wool; hardcore, serious, genuine, bona fide, true, real",onomatopoeic or mimetic word; adverb; adverb taking the と particle; noun or participle taking the aux. verb する; verb (generic); noun (generic); な adjective; adjective (generic); noun taking the genitive case particle の; colloquial,
781,ジャカスカ,jakasuka,"with gusto, freely, without any restraint, without giving a second thought",onomatopoeic or mimetic word; adverb; adverb taking the と particle,
782,ジャラジャラ,jarajara,"jingling, jangling, clinking, chinking; lasciviously, coquettishly",onomatopoeic or mimetic word; adverb; adverb taking the と particle; noun or participle taking the aux. verb する; verb (generic); noun (generic),
783,じゃんじゃか,janjaka,noisily (playing a musical instrument); doing something on and on,onomatopoeic or mimetic word; adverb,
784,すっすっ,sussuxtsu,"smoothly, frictionlessly, easily",onomatopoeic or mimetic word; adverb taking the と particle; adverb,
785,そろり,sorori,slowly and quietly; smoothly,onomatopoeic or mimetic word; adverb taking the と particle; adverb,
786,ちょっきり,chokkiri,"exactly, just; snip",onomatopoeic or mimetic word; adverb; adverb taking the と particle,
787,つっと,tsutto,"quickly, smoothly",onomatopoeic or mimetic word; adverb,
788,てらてら,teratera,"gleamingly, shinily",onomatopoeic or mimetic word; adverb; adverb taking the と particle; noun or participle taking the aux. verb する; verb (generic); noun (generic),
789,のっそり,nossori,"sluggishly, slowly, ploddingly, lumbering; stolidly (standing), impassively",onomatopoeic or mimetic word; adverb; adverb taking the と particle; noun or participle taking the aux. verb する; verb (generic); noun (generic),
790,のめのめ,nomenome,shamelessly,onomatopoeic or mimetic word; adverb; adverb taking the と particle; noun or participle taking the aux. verb する; verb (generic); noun (generic),
791,はらり,harari,gently (falling),onomatopoeic or mimetic word; adverb taking the と particle; adverb,
792,ぴよぴよ,piyopiyo,"cheep cheep, tweet tweet; gently (moving)",onomatopoeic or mimetic word; adverb; adverb taking the と particle,ひよこがピヨピヨないている。; ひよこの鳴き声はピヨピヨ、にわとりの鳴き声はコケコッコー、と表現されます。
793,びたびた,bitabita,"drenched, soaked; romantically",onomatopoeic or mimetic word; noun taking the genitive case particle の; adjective (generic); な adjective; adverb; noun or participle taking the aux. verb する; noun (generic),
794,ぴちっと,pichitto,"tightly, snugly",onomatopoeic or mimetic word; adverb; noun or participle taking the aux. verb する; verb (generic); noun (generic),
795,ぴっちり,picchiri,"tightly, snugly",onomatopoeic or mimetic word; adverb; adverb taking the と particle; noun or participle taking the aux. verb する; verb (generic); noun (generic),
796,へこへこ,hekoheko,"pliantly, pliably; subserviently, ingratiatingly, servilely",onomatopoeic or mimetic word; adverb; adverb taking the と particle; noun or participle taking the aux. verb する; verb (generic); noun (generic),
797,ぼそっと,bosotto,"absent-mindedly, vacantly, idly, lazily; in a whisper",onomatopoeic or mimetic word; adverb; noun or participle taking the aux. verb する; verb (generic); noun (generic),
798,ぽちぽち,pochipochi,"spattering, splotching; step-by-step, little-by-little; soon; dots; ditto mark",onomatopoeic or mimetic word; adverb; adverb taking the と particle; noun; noun (generic),
799,ぽっちり,pocchiri,"very slightly, a little",onomatopoeic or mimetic word; adverb; adverb taking the と particle,
800,ムカッと,mukaxtsuto,"feeling sick (suddenly), feeling queasy, feeling nauseated; being angry (suddenly), being offended, being disgusted",onomatopoeic or mimetic word; adverb; noun or participle taking the aux. verb する; verb (generic); noun (generic),
801,めためた,metameta,beyond repair,onomatopoeic or mimetic word; な adjective; adjective (generic),
802,もさっと,mosatto,"absentmindedly, vacantly, dully; to be unattractive, to be unsophisticated, to be unrefined, to be uncouth",onomatopoeic or mimetic word; adverb; noun or participle taking the aux. verb する; verb (generic); noun (generic),
803,もっそり,mossori,slowly; unrefined,onomatopoeic or mimetic word; adverb taking the と particle; adverb; noun or participle taking the aux. verb する; verb (generic); noun (generic),
804,もっさり,mossari,"slow, sluggish, dim-witted; bushy (hair), thick; unfashionable, lacking style",onomatopoeic or mimetic word; adverb; noun or participle taking the aux. verb する; verb (generic); noun (generic),
805,ムギュウ,mugyuu,"squeezing, hug, hugging",onomatopoeic or mimetic word; noun; noun (generic),
806,ブーン,bu-n,"whirr, hum, buzz; whoosh, woosh, whiz",onomatopoeic or mimetic word; adverb taking the と particle; adverb,
807,ボカッ,bokaxtsu,"bop, pow, bonk, thump",onomatopoeic or mimetic word; adverb; adverb taking the と particle,
808,グビグビ,gubigubi,in loud gulps (esp. of alcohol),onomatopoeic or mimetic word; adverb; adverb taking the と particle,
809,カランカラン,karankaran,clank clank,onomatopoeic or mimetic word; adverb taking the と particle,
810,こん,kon,"with a bump, with a clunk; yelp (e.g. of a fox), bark, howl",onomatopoeic or mimetic word; adverb taking the と particle; adverb,
811,けたけた,ketaketa,"laughing foolishly, cackling",onomatopoeic or mimetic word; adverb; adverb taking the と particle,
812,ごんごん,gongon,"bang, clang",onomatopoeic or mimetic word; adverb,
813,びしり,bishiri,"with a snap, (break) cleanly; (rejecting) sternly, flatly; smartly, (dressing up) well",onomatopoeic or mimetic word; adverb taking the と particle,
814,にょきにょき,nyokinyoki,"(shooting up) one after another, (sprouting up) all over the place; (growing) rapidly",onomatopoeic or mimetic word; adverb; adverb taking the と particle,この前蒔いた種から新芽がニョキニョキ生えてきた。; たけのこがニョキニョキ生える。
815,ピクピク,pikupiku,twitching,onomatopoeic or mimetic word; adverb; adverb taking the と particle; noun or participle taking the aux. verb する; verb (generic); noun (generic),
816,ぴくんぴくん,pikunpikun,"with a twitch, twitchingly",onomatopoeic or mimetic word; adverb; adverb taking the と particle; noun or participle taking the aux. verb する; verb (generic); noun (generic),
817,どさり,dosari,with a thud,onomatopoeic or mimetic word; adverb taking the と particle,
818,ぽとり,potori,"with a ""plop"" (of tears, drop of water, etc.)",onomatopoeic or mimetic word; adverb taking the と particle,
819,ドシンドシン,doshindoshin,"walking (with heavy steps), tramping, lumbering, clumping",onomatopoeic or mimetic word; adverb taking the と particle,わたしの上の階に住んでいる人はよほど体が大きいようで、歩くたびどしんどしんと音が聞こえて来る。夜などは迷惑だ。; 動物園で見た象はとても大きかった。歩くたびどしんどしんと聞こえてきそうだった。
820,シューシュー,shu-shu-,"hiss, fizz, woosh, swish, whiz",onomatopoeic or mimetic word; adverb taking the と particle,
821,バンバン,banban,"with a bang bang (e.g. repeated sound of a hammer or gunfire); at a mad pace, with great vigor",onomatopoeic or mimetic word; adverb,
822,ブスブス,busubusu,"sputtering, smoldering; repeated thrusting into something (sword, needle, etc.), pricking repeatedly; mutterings of discontent, faint sounds of complaint",onomatopoeic or mimetic word; adverb taking the と particle; adverb; noun or participle taking the aux. verb する; verb (generic); noun (generic),
823,ぐにゃり,gunyari,"flabbily, softly, limply, easily (bend), effortlessly, flexibly, mushily",onomatopoeic or mimetic word; adverb; adverb taking the と particle,
824,ちょん,chon,"clap (sound of wooden clappers); chop vigorously; slight movement (e.g. poke, small bird alighting); the end, originally end of a play, marked by clap of clappers; dot (esp. typographical)",onomatopoeic or mimetic word; adverb taking the と particle; noun; noun (generic),
825,ばきっと,bakitto,snapping (e.g. branch),onomatopoeic or mimetic word; adverb,
826,ねとねと,netoneto,"stickily, gooily, syrupily",onomatopoeic or mimetic word; adverb; noun or participle taking the aux. verb する; verb (generic); noun (generic),
827,ぴしり,pishiri,"with a click, with a snap",onomatopoeic or mimetic word; adverb taking the と particle,
828,ぎこぎこ,gikogiko,"squeak squeak, squeaking",onomatopoeic or mimetic word; adverb; adverb taking the と particle,
829,ガクガクブルブル,gakugakuburuburu,chattering (of teeth) and trembling (with fear),onomatopoeic or mimetic word; adverb taking the と particle; noun or participle taking the aux. verb する; verb (generic); noun (generic),
830,バキバキ,bakibaki,"with a crack (e.g. branches, knuckles)",onomatopoeic or mimetic word; adverb; adverb taking the と particle,
831,キャン,kyan,"yelp; sales campaign; kiang (Equus hemionus kiang), kyang",onomatopoeic or mimetic word; adverb taking the と particle; abbreviation; noun; noun (generic),
832,かしゃかしゃ,kashakasha,"click-clack, clickety-click, clicking sound, clattering sound",onomatopoeic or mimetic word; adverb taking the と particle,
833,ゲーゲー,ge-ge-,(with a) vomiting sound,onomatopoeic or mimetic word; adverb; adverb taking the と particle,
834,パチン,pachin,"with a click, with a snap; ornamental clip (hair, obi, etc.)",onomatopoeic or mimetic word; adverb taking the と particle; adverb; abbreviation; noun; noun (generic),マジシャンが指をパチンとならすとハットから鳩が出てきた。; 彼女は彼の頬をぱちんと叩いた。
835,ゴツンゴツン,gotsungotsun,"thumping, banging",onomatopoeic or mimetic word; adverb; adverb taking the と particle,
836,ばちん,bachin,"(with a) slap, smack, whack, sound of a sharp blow with something flat; wham, sound of striking with something solid; zap, crack, sound of thunder",onomatopoeic or mimetic word; adverb taking the と particle,
837,ドスンドスン,dosundosun,"thud thud (esp. footsteps), clump clump",onomatopoeic or mimetic word; adverb,
838,どすっと,dosutto,"thump, thud, bump, clunk",onomatopoeic or mimetic word; adverb,
839,ひゅーっ,hyu-xtsu,"(with a) whizzing sound, sound of something whizzing by",onomatopoeic or mimetic word; adverb taking the と particle,
840,シコシコ,shikoshiko,"chewy, springy, al dente; slowly but steadily; masturbation, fap fap",onomatopoeic or mimetic word; noun; noun (generic); noun or participle taking the aux. verb する,
841,習習,shuushuu,gentle breeze,onomatopoeic or mimetic word; たる adjective; adjective (generic); adverb taking the と particle,
842,ぷっつり,puttsuri,"(breaking) with a snap (of a thread, rope, etc.); (stopping) suddenly (of communications, a practice, etc.), abruptly, completely, once and for all",onomatopoeic or mimetic word; adverb; adverb taking the と particle,
843,ギンギン,gingin,"ecstatic, ecstatically; splitting headache",onomatopoeic or mimetic word; adverb,
844,トコトコ,tokotoko,"briskly with small steps, trotting",onomatopoeic or mimetic word; adverb; adverb taking the と particle,
845,ずらずら,zurazura,"in succession, in an endless stream, continuing without pause or interruption",onomatopoeic or mimetic word; adverb taking the と particle,
846,こっきり,kokkiri,"only, just; with a snap",suffix; onomatopoeic or mimetic word; obsolete term; adverb,
847,くっくっと,kukkutto,"with a chuckle, with a giggle",onomatopoeic or mimetic word; adverb,
848,かぴかぴ,kapikapi,"crusty, flaky, dried out",onomatopoeic or mimetic word; colloquial; な adjective; adjective (generic); adverb; noun taking the genitive case particle の,
849,ダボダボ,dabodabo,"loose (of clothing), loose-fitting; plenty (of pouring a liquid); sloshing about (e.g. of water in one's stomach)",onomatopoeic or mimetic word; noun taking the genitive case particle の; adjective (generic); な adjective; adverb taking the と particle; noun or participle taking the aux. verb する; noun (generic); adverb,
850,すっぱ,suppa,"cleanly (cutting, snapping off, etc.), in a single blow",onomatopoeic or mimetic word; adverb; adverb taking the と particle,
851,ふっくり,fukkuri,"fully, luxuriantly, fluffy, plump, soft and full, corpulent",onomatopoeic or mimetic word; adverb taking the と particle,
852,ちろちろ,chirochiro,"flicker (light), waver; trickle (water); glance at",onomatopoeic or mimetic word; adverb taking the と particle,
853,トホホ,tohoho,"boo-hoo, boo-hoo-hoo",onomatopoeic or mimetic word; interjection; な adjective; adjective (generic),
854,ばっさばっさ,bassabassa,"rapidly, flapping wings",onomatopoeic or mimetic word; adverb taking the と particle; adverb,
855,噁噁,akuaku,"chirp, tweet, caw",onomatopoeic or mimetic word; usually written using kana alone; adverb,
856,ぺらっと,peratto,"flipping (e.g. a page), peeling off; fluently",onomatopoeic or mimetic word; adverb,
857,ぷるぷる,purupuru,"trembling, shivering; jiggling, wobbling, bouncing",onomatopoeic or mimetic word; adverb; adverb taking the と particle; noun or participle taking the aux. verb する; verb (generic); noun (generic),
858,のしのし,noshinoshi,"walking heavily, lumbering",onomatopoeic or mimetic word; adverb; adverb taking the と particle,
859,ざぶりざぶり,zaburizaburi,"sound of living, moving water",onomatopoeic or mimetic word; adverb taking the と particle,
860,じとじと,jitojito,"damp, wet, soaked, humid, clammy",onomatopoeic or mimetic word; な adjective; adjective (generic); adverb; adverb taking the と particle; noun or participle taking the aux. verb する; noun (generic),
861,ぺたり,petari,"slapping on (stamp, sticker); flopping down",onomatopoeic or mimetic word; adverb taking the と particle,
862,つるり,tsururi,"smoothly, with a slipping or sliding motion",onomatopoeic or mimetic word; adverb taking the と particle,
863,メリメリ,merimeri,"cracking, splitting, ripping, crashing, creaking, groaning",onomatopoeic or mimetic word; adverb taking the と particle,
864,タプタプ,taputapu,flabby,onomatopoeic or mimetic word; noun taking the genitive case particle の; adjective (generic); adverb; adverb taking the と particle; noun or participle taking the aux. verb する; noun (generic),
865,たぶたぶ,tabutabu,"brimming, full to the point of overflowing; loose, baggy",onomatopoeic or mimetic word; adverb taking the と particle,
866,フッ,fuxtsu,"hah (derisively), pooh; pfft (of something disappearing), poof; huff, puff",interjection; onomatopoeic or mimetic word; adverb taking the と particle,
867,ばちゃん,bachan,with a splash,onomatopoeic or mimetic word; adverb; adverb taking the と particle,
868,ぴょこぴょこ,pyokopyoko,"up and down, lightly, nimbly, moving in small leaps as a frog or rabbit; casually, (strolling about) without a care",onomatopoeic or mimetic word; adverb taking the と particle,
869,どっぴゅ,doppyu,sound of something being powerfully ejected,onomatopoeic or mimetic word; adverb; adverb taking the と particle,
870,ことん,koton,"clunk, thump",onomatopoeic or mimetic word; adverb taking the と particle,
871,ぴゅう,pyuu,"whiz (e.g. projectile through air), swoosh, whoosh, whistling sound",onomatopoeic or mimetic word; adverb taking the と particle,
872,くるっと,kurutto,"turning around, spinning around, curling up; round and charming (e.g. eyes)",onomatopoeic or mimetic word; adverb; noun or participle taking the aux. verb する; verb (generic); noun (generic),道を間違えたので車をくるっとＵターンさせた。
873,ぱらり,parari,"sprinkling, dropping in small light bits",onomatopoeic or mimetic word; adverb taking the と particle; adverb,
874,どうと,douto,"crash, smash, bang, sound of a large, heavy object falling",obsolete reading; onomatopoeic or mimetic word; adverb,
875,ピチャリ,pichari,"sound of a small wave hitting the shore, sound of a whip, sound of a slap",onomatopoeic or mimetic word; adverb,
876,ぴちゃん,pichan,"splash; slam, slap",onomatopoeic or mimetic word; adverb taking the と particle; adverb,
877,とろり,torori,"thickly, viscously, stickily, creamily, (melting and) becoming soft; sleepily, drowsily, dozing off",onomatopoeic or mimetic word; adverb taking the と particle; adverb,
878,ごとり,gotori,"with a thump, with a clang, with a clank",onomatopoeic or mimetic word; adverb taking the と particle,
879,そぼそぼ,sobosobo,drizzling (rain),onomatopoeic or mimetic word; adverb; adverb taking the と particle,
880,デクデク,dekudeku,"plump, fat",onomatopoeic or mimetic word; adverb,
881,シュッシュッ,shusshuxtsu,"choo-choo, chug-chug, chuff-chuff, hiss-hiss; brush-brush, scrub-scrub",onomatopoeic or mimetic word; adverb taking the と particle; adverb,
882,どしり,doshiri,sound of a heavy object falling,onomatopoeic or mimetic word; adverb taking the と particle; adverb,
883,どかり,dokari,falling heavily,onomatopoeic or mimetic word; adverb taking the と particle; adverb,
884,ボーボー,bo-bo-,"vigorously (burning), furiously, fiercely",onomatopoeic or mimetic word; adverb taking the と particle; adverb,
885,ジンジン,jinjin,"(painful) tingling, throbbing (with pain), stinging, feeling numb; noisily (ringing)",onomatopoeic or mimetic word; adverb; adverb taking the と particle,昨日こけたところがまだまだジンジンと痛む。; 虫歯がひどくなってジンジンと痛み出してきた。
886,バリッと,barixtsuto,"with a crack, with a tearing sound, with a ripping sound; stylish, smart, dapper, dashing, spruce",onomatopoeic or mimetic word; adverb; noun or participle taking the aux. verb する; verb (generic); noun (generic),激しいダンスを踊ったせいでズボンがバリッと破れてしまった。; (板チョコやおせんべいなどを)クリス： これどうやって分けよう？ジャスティン： バリッと割っちゃえば？
887,ぽちゃり,pochari,"splash, splosh",onomatopoeic or mimetic word; adverb taking the と particle; adverb,
888,ぐらり,gurari,shaking violently,onomatopoeic or mimetic word; adverb taking the と particle; adverb,
889,ポッと,poxtsuto,"slightly (blushing); suddenly (getting bright, flaring up, flashing on, etc.); distractedly",onomatopoeic or mimetic word; adverb; noun or participle taking the aux. verb する; verb (generic); noun (generic),
890,ぶるん,burun,"with a vroom, with a sudden shaking",onomatopoeic or mimetic word; adverb taking the と particle; adverb,
891,どんぶりこ,donburiko,"plop, splash; tumbling",onomatopoeic or mimetic word; adverb; adverb taking the と particle,
892,チュンチュン,chunchun,"chirp, cheep",onomatopoeic or mimetic word; adverb; adverb taking the と particle,朝はスズメのチュンチュンと鳴く声で目が覚める。
893,ぎいとん,giiton,squeaking or creaking (followed by a thump),onomatopoeic or mimetic word; adverb; adverb taking the と particle,
894,むくむく,mukumuku,"rising up (of smoke, clouds, etc.), towering, billowing; plump, chubby; welling up (of an emotion), boiling up; getting up, stirring, moving about; shaggy, hairy",onomatopoeic or mimetic word; adverb; adverb taking the と particle; noun or participle taking the aux. verb する; verb (generic); noun (generic),
895,ほんわか,honwaka,"warm, snug, cozy, cosy, comfortable, pleasant, soft, fluffy, gentle",onomatopoeic or mimetic word; adverb; adverb taking the と particle,
896,ぱったり,pattari,"unexpectedly, suddenly, abruptly",onomatopoeic or mimetic word; adverb; adverb taking the と particle,
897,ぶらりぶらり,burariburari,"dangling, swaying, swinging; (walking) leisurely, aimlessly, strolling, wandering, rambling; idly, lazily, leisurely, aimlessly",onomatopoeic or mimetic word; adverb; adverb taking the と particle,
898,パカパカ,pakapaka,"clip-clop, clippety-clop; clamshell cellphone, flip cellphone",onomatopoeic or mimetic word; adverb taking the と particle; adverb; noun; noun (generic),
899,とくとく,tokutoku,glug-glug,onomatopoeic or mimetic word; adverb taking the と particle; adverb,
900,とん,ton,"tap, knock, bonk",onomatopoeic or mimetic word; adverb taking the と particle; adverb,
901,ザブン,zabun,"splash, plop",onomatopoeic or mimetic word; adverb taking the と particle; adverb,
902,パシャッと,pashaxtsuto,"with a splash, with a splosh; with a click (of a camera shutter), with a snap",onomatopoeic or mimetic word; adverb,
903,じわっと,jiwatto,slowly but steadily,onomatopoeic or mimetic word; adverb,
904,ペロリ,perori,"(eating up) quickly, in no time, gobbling up; quickly (sticking out one's tongue); licking, licking up; (peeling off) in one go, completely",onomatopoeic or mimetic word; adverb taking the と particle; adverb,まゆ： 甘いものに目がないんだ〜、いくらでも食べてしまう。ゆき： そうなんだ、じゃあホールのケーキ一人で食べれる？まゆ： そんなのペロリだね。
905,ぴりり,piriri,"tingling, stinging, pungently",onomatopoeic or mimetic word; adverb; adverb taking the と particle; noun or participle taking the aux. verb する; verb (generic); noun (generic),
906,ぷるんぷるん,purunpurun,"shaking like a jelly, jellylike",onomatopoeic or mimetic word; noun; noun (generic); noun or verb acting prenominally; adjective (generic); noun or participle taking the aux. verb する,
907,ばしっと,bashitto,"whack, smack",onomatopoeic or mimetic word; adverb,
908,しねしね,shineshine,"soft and elastic, flexible, pliant",onomatopoeic or mimetic word; adverb; adverb taking the と particle; noun or participle taking the aux. verb する; verb (generic); noun (generic),
909,のそりのそり,nosorinosori,"slowly, stolidly, heavily, lumpingly",onomatopoeic or mimetic word; adverb; adverb taking the と particle,
910,ぷるん,purun,"shaking like a jelly, jellylike",onomatopoeic or mimetic word; noun; noun (generic); noun or verb acting prenominally; adjective (generic); noun or participle taking the aux. verb する,
911,こちょこちょ,kochokocho,"coochy-coo, hitchy-koo, kitchy-koo (tickling sound)",onomatopoeic or mimetic word; adverb; adverb taking the と particle; noun or participle taking the aux. verb する; verb (generic); noun (generic),
912,ごそり,gosori,"rustling sound, rummaging sound",onomatopoeic or mimetic word; adverb; adverb taking the と particle,
913,がさり,gasari,rustling sound; search (esp. a home search by the police),onomatopoeic or mimetic word; adverb taking the と particle; adverb; rare term; slang; noun; noun (generic),
914,すぽっと,supotto,"snugly (into hole, container, etc.), tightly (fitting, covering), firmly; (with a) pop (i.e. sound of a cork, etc. being pulled out of a hole in one movement), with a plop, (fall) straight",onomatopoeic or mimetic word; adverb,
915,ぷつぷつ,putsuputsu,"bumpy (e.g. of a rash), knobbly, pimply; easily cut",onomatopoeic or mimetic word; adverb; adverb taking the と particle; noun or participle taking the aux. verb する; verb (generic); noun (generic),
916,ゆくと,yukuto,"slowly, unhurriedly, without haste, leisurely, at one's leisure",onomatopoeic or mimetic word; archaic; adverb,
